{
  "head_sha": "a1b2c3d4e5f60718293a4b5c6d7e8f9012345678",
  "files": [
    "src/generated/file-0.ts",
    "src/generated/file-1.ts",
    "src/generated/file-2.ts",
    "src/generated/file-3.ts",
    "src/generated/file-4.ts",
    "src/generated/file-5.ts",
    "src/generated/file-6.ts",
    "src/generated/file-7.ts",
    "src/generated/file-8.ts",
    "src/generated/file-9.ts",
    "src/generated/file-10.ts",
    "src/generated/file-11.ts",
    "src/generated/file-12.ts",
    "src/generated/file-13.ts",
    "src/generated/file-14.ts",
    "src/generated/file-15.ts",
    "src/generated/file-16.ts",
    "src/generated/file-17.ts",
    "src/generated/file-18.ts",
    "src/generated/file-19.ts",
    "src/generated/file-20.ts",
    "src/generated/file-21.ts",
    "src/generated/file-22.ts",
    "src/generated/file-23.ts",
    "src/generated/file-24.ts",
    "src/generated/file-25.ts",
    "src/generated/file-26.ts",
    "src/generated/file-27.ts",
    "src/generated/file-28.ts",
    "src/generated/file-29.ts",
    "src/generated/file-30.ts",
    "src/generated/file-31.ts",
    "src/generated/file-32.ts",
    "src/generated/file-33.ts",
    "src/generated/file-34.ts",
    "src/generated/file-35.ts",
    "src/generated/file-36.ts",
    "src/generated/file-37.ts",
    "src/generated/file-38.ts",
    "src/generated/file-39.ts",
    "src/generated/file-40.ts",
    "src/generated/file-41.ts",
    "src/generated/file-42.ts",
    "src/generated/file-43.ts",
    "src/generated/file-44.ts",
    "src/generated/file-45.ts",
    "src/generated/file-46.ts",
    "src/generated/file-47.ts",
    "src/generated/file-48.ts",
    "src/generated/file-49.ts",
    "src/generated/file-50.ts",
    "src/generated/file-51.ts",
    "src/generated/file-52.ts",
    "src/generated/file-53.ts",
    "src/generated/file-54.ts",
    "src/generated/file-55.ts",
    "src/generated/file-56.ts",
    "src/generated/file-57.ts",
    "src/generated/file-58.ts",
    "src/generated/file-59.ts",
    "src/generated/file-60.ts",
    "src/generated/file-61.ts",
    "src/generated/file-62.ts",
    "src/generated/file-63.ts",
    "src/generated/file-64.ts",
    "src/generated/file-65.ts",
    "src/generated/file-66.ts",
    "src/generated/file-67.ts",
    "src/generated/file-68.ts",
    "src/generated/file-69.ts",
    "src/generated/file-70.ts",
    "src/generated/file-71.ts",
    "src/generated/file-72.ts",
    "src/generated/file-73.ts",
    "src/generated/file-74.ts",
    "src/generated/file-75.ts",
    "src/generated/file-76.ts",
    "src/generated/file-77.ts",
    "src/generated/file-78.ts",
    "src/generated/file-79.ts",
    "src/generated/file-80.ts",
    "src/generated/file-81.ts",
    "src/generated/file-82.ts",
    "src/generated/file-83.ts",
    "src/generated/file-84.ts",
    "src/generated/file-85.ts",
    "src/generated/file-86.ts",
    "src/generated/file-87.ts",
    "src/generated/file-88.ts",
    "src/generated/file-89.ts",
    "src/generated/file-90.ts",
    "src/generated/file-91.ts",
    "src/generated/file-92.ts",
    "src/generated/file-93.ts",
    "src/generated/file-94.ts",
    "src/generated/file-95.ts",
    "src/generated/file-96.ts",
    "src/generated/file-97.ts",
    "src/generated/file-98.ts",
    "src/generated/file-99.ts",
    "src/generated/file-100.ts",
    "src/generated/file-101.ts",
    "src/generated/file-102.ts",
    "src/generated/file-103.ts",
    "src/generated/file-104.ts",
    "src/generated/file-105.ts",
    "src/generated/file-106.ts",
    "src/generated/file-107.ts",
    "src/generated/file-108.ts",
    "src/generated/file-109.ts",
    "src/generated/file-110.ts",
    "src/generated/file-111.ts",
    "src/generated/file-112.ts",
    "src/generated/file-113.ts",
    "src/generated/file-114.ts",
    "src/generated/file-115.ts",
    "src/generated/file-116.ts",
    "src/generated/file-117.ts",
    "src/generated/file-118.ts",
    "src/generated/file-119.ts",
    "src/generated/file-120.ts",
    "src/generated/file-121.ts",
    "src/generated/file-122.ts",
    "src/generated/file-123.ts",
    "src/generated/file-124.ts",
    "src/generated/file-125.ts",
    "src/generated/file-126.ts",
    "src/generated/file-127.ts",
    "src/generated/file-128.ts",
    "src/generated/file-129.ts",
    "src/generated/file-130.ts",
    "src/generated/file-131.ts",
    "src/generated/file-132.ts",
    "src/generated/file-133.ts",
    "src/generated/file-134.ts",
    "src/generated/file-135.ts",
    "src/generated/file-136.ts",
    "src/generated/file-137.ts",
    "src/generated/file-138.ts",
    "src/generated/file-139.ts",
    "src/generated/file-140.ts",
    "src/generated/file-141.ts",
    "src/generated/file-142.ts",
    "src/generated/file-143.ts",
    "src/generated/file-144.ts",
    "src/generated/file-145.ts",
    "src/generated/file-146.ts",
    "src/generated/file-147.ts",
    "src/generated/file-148.ts",
    "src/generated/file-149.ts",
    "src/generated/file-150.ts",
    "src/generated/file-151.ts",
    "src/generated/file-152.ts",
    "src/generated/file-153.ts",
    "src/generated/file-154.ts",
    "src/generated/file-155.ts",
    "src/generated/file-156.ts",
    "src/generated/file-157.ts",
    "src/generated/file-158.ts",
    "src/generated/file-159.ts",
    "src/generated/file-160.ts",
    "src/generated/file-161.ts",
    "src/generated/file-162.ts",
    "src/generated/file-163.ts",
    "src/generated/file-164.ts",
    "src/generated/file-165.ts",
    "src/generated/file-166.ts",
    "src/generated/file-167.ts",
    "src/generated/file-168.ts",
    "src/generated/file-169.ts",
    "src/generated/file-170.ts",
    "src/generated/file-171.ts",
    "src/generated/file-172.ts",
    "src/generated/file-173.ts",
    "src/generated/file-174.ts",
    "src/generated/file-175.ts",
    "src/generated/file-176.ts",
    "src/generated/file-177.ts",
    "src/generated/file-178.ts",
    "src/generated/file-179.ts",
    "src/generated/file-180.ts",
    "src/generated/file-181.ts",
    "src/generated/file-182.ts",
    "src/generated/file-183.ts",
    "src/generated/file-184.ts",
    "src/generated/file-185.ts",
    "src/generated/file-186.ts",
    "src/generated/file-187.ts",
    "src/generated/file-188.ts",
    "src/generated/file-189.ts",
    "src/generated/file-190.ts",
    "src/generated/file-191.ts",
    "src/generated/file-192.ts",
    "src/generated/file-193.ts",
    "src/generated/file-194.ts",
    "src/generated/file-195.ts",
    "src/generated/file-196.ts",
    "src/generated/file-197.ts",
    "src/generated/file-198.ts",
    "src/generated/file-199.ts",
    "src/generated/file-200.ts",
    "src/generated/file-201.ts",
    "src/generated/file-202.ts",
    "src/generated/file-203.ts",
    "src/generated/file-204.ts",
    "src/generated/file-205.ts",
    "src/generated/file-206.ts",
    "src/generated/file-207.ts",
    "src/generated/file-208.ts",
    "src/generated/file-209.ts",
    "src/generated/file-210.ts",
    "src/generated/file-211.ts",
    "src/generated/file-212.ts",
    "src/generated/file-213.ts",
    "src/generated/file-214.ts",
    "src/generated/file-215.ts",
    "src/generated/file-216.ts",
    "src/generated/file-217.ts",
    "src/generated/file-218.ts",
    "src/generated/file-219.ts",
    "src/generated/file-220.ts",
    "src/generated/file-221.ts",
    "src/generated/file-222.ts",
    "src/generated/file-223.ts",
    "src/generated/file-224.ts",
    "src/generated/file-225.ts",
    "src/generated/file-226.ts",
    "src/generated/file-227.ts",
    "src/generated/file-228.ts",
    "src/generated/file-229.ts",
    "src/generated/file-230.ts",
    "src/generated/file-231.ts",
    "src/generated/file-232.ts",
    "src/generated/file-233.ts",
    "src/generated/file-234.ts",
    "src/generated/file-235.ts",
    "src/generated/file-236.ts",
    "src/generated/file-237.ts",
    "src/generated/file-238.ts",
    "src/generated/file-239.ts",
    "src/generated/file-240.ts",
    "src/generated/file-241.ts",
    "src/generated/file-242.ts",
    "src/generated/file-243.ts",
    "src/generated/file-244.ts",
    "src/generated/file-245.ts",
    "src/generated/file-246.ts",
    "src/generated/file-247.ts",
    "src/generated/file-248.ts",
    "src/generated/file-249.ts",
    "src/generated/file-250.ts",
    "src/generated/file-251.ts",
    "src/generated/file-252.ts",
    "src/generated/file-253.ts",
    "src/generated/file-254.ts",
    "src/generated/file-255.ts",
    "src/generated/file-256.ts",
    "src/generated/file-257.ts",
    "src/generated/file-258.ts",
    "src/generated/file-259.ts",
    "src/generated/file-260.ts",
    "src/generated/file-261.ts",
    "src/generated/file-262.ts",
    "src/generated/file-263.ts",
    "src/generated/file-264.ts",
    "src/generated/file-265.ts",
    "src/generated/file-266.ts",
    "src/generated/file-267.ts",
    "src/generated/file-268.ts",
    "src/generated/file-269.ts",
    "src/generated/file-270.ts",
    "src/generated/file-271.ts",
    "src/generated/file-272.ts",
    "src/generated/file-273.ts",
    "src/generated/file-274.ts",
    "src/generated/file-275.ts",
    "src/generated/file-276.ts",
    "src/generated/file-277.ts",
    "src/generated/file-278.ts",
    "src/generated/file-279.ts",
    "src/generated/file-280.ts",
    "src/generated/file-281.ts",
    "src/generated/file-282.ts",
    "src/generated/file-283.ts",
    "src/generated/file-284.ts",
    "src/generated/file-285.ts",
    "src/generated/file-286.ts",
    "src/generated/file-287.ts",
    "src/generated/file-288.ts",
    "src/generated/file-289.ts",
    "src/generated/file-290.ts",
    "src/generated/file-291.ts",
    "src/generated/file-292.ts",
    "src/generated/file-293.ts",
    "src/generated/file-294.ts",
    "src/generated/file-295.ts",
    "src/generated/file-296.ts",
    "src/generated/file-297.ts",
    "src/generated/file-298.ts",
    "src/generated/file-299.ts"
  ],
  "files_truncated": true,
  "mergeable": "UNKNOWN",
  "state": "OPEN",
  "matched": {}
}
